{
  "$schema": "https://json-schema.org/draft/2020-12/schema",
  "$id": "https://devai.nyxk.com.br/schemas/phase-closure.schema.json",
  "title": "PhaseClosure",
  "description": "Machine-recorded closure of a phase or round (D-110, governance-roadmap item 4). Replaces the hand-narrated portion of closing D-entries: gate posture, batch list, validation criteria, and the no-deletion flag become data; derived properties (consecutive-streak counters, scope trends) are computed from the ledger by `devai govern phase ledger`, never stored as prose. The closing D-entry shrinks to a human judgment plus a pointer to this record. Written by `devai govern phase close` to record/proofs/compliance/closures/PC-NNNN.json (tracked, append-only by convention: a recorded closure is never edited; corrections append a new record with `supersedes`).",
  "type": "object",
  "additionalProperties": false,
  "required": [
    "schemaVersion",
    "id",
    "round_id",
    "declaring_decision",
    "closing_decision",
    "batches",
    "gates",
    "source_repo_deleted",
    "validation_criteria",
    "closed_at"
  ],
  "properties": {
    "schemaVersion": {
      "const": "1.0.0"
    },
    "id": {
      "type": "string",
      "pattern": "^PC-[0-9]{4}$",
      "description": "Sequential closure id. Assigned by `devai govern phase close` as max(existing) + 1."
    },
    "round_id": {
      "type": "string",
      "minLength": 1,
      "description": "Human identifier of the closed unit, e.g. 'phase-39', 'round-14', 'drift-remediation'."
    },
    "title": {
      "type": "string",
      "description": "One-line headline of what the phase/round shipped."
    },
    "declaring_decision": {
      "type": "string",
      "pattern": "^(?:D-[0-9]+|DII-[0-9]+)$",
      "description": "The D-entry that declared the phase/round."
    },
    "closing_decision": {
      "type": "string",
      "pattern": "^(?:D-[0-9]+|DII-[0-9]+)$",
      "description": "The D-entry that records the closing judgment."
    },
    "batches": {
      "type": "array",
      "minItems": 1,
      "items": {
        "type": "object",
        "additionalProperties": false,
        "required": ["id", "roles", "headline"],
        "properties": {
          "id": {
            "type": "string",
            "minLength": 1
          },
          "roles": {
            "type": "array",
            "minItems": 1,
            "items": {
              "enum": ["Owner", "Architect", "Inspector", "Engineer", "Auditor", "Machine"]
            }
          },
          "commit": {
            "type": "string",
            "pattern": "^[0-9a-f]{7,40}$",
            "description": "Commit SHA the batch landed as. Optional for batches folded into the closing commit."
          },
          "headline": {
            "type": "string",
            "minLength": 1
          }
        }
      }
    },
    "gates": {
      "type": "object",
      "description": "Gate-sweep results at close, keyed by gate name (e.g. lint, typecheck, unit, integration, contract, docs-links, docs-governance, spec-validate-all).",
      "minProperties": 1,
      "propertyNames": {
        "type": "string",
        "minLength": 1,
        "pattern": ".*\\S.*"
      },
      "additionalProperties": {
        "type": "object",
        "additionalProperties": false,
        "required": ["status"],
        "properties": {
          "status": {
            "enum": ["pass", "fail", "skipped"]
          },
          "detail": {
            "type": "string",
            "description": "Free-form evidence, e.g. '704 passed / 1 skipped'."
          }
        }
      }
    },
    "source_repo_deleted": {
      "type": "boolean",
      "description": "Whether the phase/round deleted an absorbed source repo. The consecutive no-deletion streak is computed from this field by `devai govern phase ledger` — never hand-narrated."
    },
    "validation_criteria": {
      "type": "array",
      "minItems": 1,
      "items": {
        "type": "object",
        "additionalProperties": false,
        "required": ["criterion", "verdict"],
        "properties": {
          "criterion": {
            "type": "string",
            "minLength": 1
          },
          "verdict": {
            "enum": ["pass", "fail", "n/a"]
          },
          "evidence": {
            "type": "string"
          }
        }
      }
    },
    "closed_at": {
      "type": "string",
      "format": "date-time"
    },
    "supersedes": {
      "type": "string",
      "pattern": "^PC-[0-9]{4}$",
      "description": "Set when this record corrects an earlier closure; the earlier record's bytes stay untouched."
    },
    "merged_as": {
      "type": "string",
      "pattern": "^[0-9a-f]{7,40}$",
      "description": "The integration-branch commit the closed round actually shipped as (merge commit or branch tip on main). Historical records remain schema-valid without this field, but every new successor record emitted by `devai govern phase close` requires it."
    },
    "release_disposition": {
      "enum": ["published", "changeset-pending", "none-preratification", "none-needed", "missing"],
      "description": "Whether the round's package changes have a release path: 'published' (release cut), 'changeset-pending' (changeset recorded, publish pending), 'none-preratification' (package-visible changes intentionally withheld until ratification), 'none-needed' (no package-visible changes), or 'missing' (package changes shipped with no changeset — a recorded defect, never a silent one). Historical records remain schema-valid without this field, but every new successor record emitted by `devai govern phase close` requires it."
    },
    "evidence": {
      "type": "object",
      "additionalProperties": false,
      "required": ["proof_epoch", "terminal_sha256"],
      "properties": {
        "proof_epoch": {
          "type": "string",
          "minLength": 1
        },
        "terminal_sha256": {
          "$ref": "common-defs.schema.json#/$defs/sha256"
        }
      },
      "description": "Machine-evidence epoch bound by this closure. The terminal hash commits to the complete line-hash chain."
    },
    "notes": {
      "type": "string"
    }
  },
  "schema_version": "1.0.0",
  "examples": [
    {
      "schemaVersion": "1.0.0",
      "id": "PC-0001",
      "closed_at": "2026-06-10T03:30:00.000Z",
      "round_id": "drift-remediation",
      "declaring_decision": "D-108",
      "closing_decision": "D-109",
      "batches": [
        {
          "id": "DR.A",
          "roles": ["Architect"],
          "headline": "Constitution 0.2.0 -> 0.3.0 (Articles 1, 23, 27); BUILD-PLAN history frozen to archive; README/CLAUDE refresh; docs_drift schema enum; D-108"
        }
      ],
      "gates": {
        "sense-docs-drift": {
          "status": "pass"
        }
      },
      "source_repo_deleted": false,
      "validation_criteria": [
        {
          "criterion": "four CI-equivalent gates green",
          "verdict": "pass"
        }
      ]
    }
  ]
}
