{
  "schemaVersion": "1.0.0",
  "id": "PC-0002",
  "closed_at": "2026-07-25T00:20:09.645Z",
  "round_id": "R-0001",
  "title": "Bootstrapped the DEVAI successor under provisional predecessor binding",
  "declaring_decision": "DII-1",
  "closing_decision": "DII-072",
  "batches": [
    {
      "id": "P0",
      "roles": [
        "Architect"
      ],
      "commit": "14439b05c1b9d1390db10be5d32fbc7281978b46",
      "headline": "Created the clean successor genesis and provisional predecessor binding"
    },
    {
      "id": "P1",
      "roles": [
        "Architect"
      ],
      "commit": "7c3d34b2455d7086ce02202fe4f5f225b62e09a3",
      "headline": "Completed the draft law, governed populations, schemas, and CLI surface tiers"
    },
    {
      "id": "P2",
      "roles": [
        "Architect"
      ],
      "commit": "a77f9d2dbdfebc3fd44bcde8181fc8b049e22417",
      "headline": "Applied the recorded Owner product marks and deferred the remaining correction"
    },
    {
      "id": "P3",
      "roles": [
        "Architect"
      ],
      "commit": "ab3c88327312d7ec0caae1394bf7000fc9cb8244",
      "headline": "Migrated the successor publication corpus under the documentation canon"
    },
    {
      "id": "P4",
      "roles": [
        "Engineer"
      ],
      "commit": "4161554d9ad0b61067a6093d897d01f908293aa8",
      "headline": "Integrated the transposed package graph against successor law"
    },
    {
      "id": "P5",
      "roles": [
        "Inspector"
      ],
      "commit": "5df51c62a07ed81c19c33126dea2afa156392832",
      "headline": "Materialized and stabilized the six-tier verification ladder"
    },
    {
      "id": "P6",
      "roles": [
        "Auditor"
      ],
      "commit": "bdd0859ce6cda6e2160c03bf7a71293fa14904bb",
      "headline": "Reconciled the exhaustive successor backlog and seeded the as-built audit"
    },
    {
      "id": "P7",
      "roles": [
        "Engineer"
      ],
      "commit": "620b9dad3e247ad8ab64277b9411e523e5ed8c77",
      "headline": "Wired bootstrap verification stages and local evidence checks"
    },
    {
      "id": "P8a",
      "roles": [
        "Auditor"
      ],
      "commit": "871a9bf0204b212cb34fdc844d109eb1ab6a522e",
      "headline": "Finalized the R-0001 as-built audit and honest claims boundary"
    },
    {
      "id": "P8b",
      "roles": [
        "Architect"
      ],
      "commit": "39ce7f8b501ee9bdbd4a8dc214f9c531cfbf0c04",
      "headline": "Aligned the closure contract, cleared placeholders, and updated post-bootstrap status"
    }
  ],
  "gates": {
    "tier-t1": {
      "status": "pass",
      "detail": "47 test files; 590 passed"
    },
    "tier-t2": {
      "status": "pass",
      "detail": "24 test files; 140 passed; 1 skipped"
    },
    "tier-t3": {
      "status": "pass",
      "detail": "9 test files; 50 passed; 7 skipped"
    },
    "tier-t4": {
      "status": "pass",
      "detail": "2 test files; 4 passed"
    },
    "tier-t5": {
      "status": "pass",
      "detail": "6 test files; 25 passed"
    },
    "tier-t6": {
      "status": "pass",
      "detail": "1 test file; 3 passed"
    },
    "coverage-t1-t3": {
      "status": "fail",
      "detail": "29.2% lines / 26.81% branches / 31.09% functions / 28.22% statements versus 70/60/70/70; governed by BL-017"
    },
    "workflow-lint": {
      "status": "pass"
    },
    "changesets": {
      "status": "pass"
    },
    "predecessor-clean": {
      "status": "pass",
      "detail": "Read-only predecessor at d76cd12d2241a1a28a32a0fe629c6531da7fe74d"
    },
    "unresolved-placeholders": {
      "status": "pass",
      "detail": "No unresolved placeholder markers outside scratch/"
    }
  },
  "source_repo_deleted": false,
  "validation_criteria": [
    {
      "criterion": "Successor bootstrap transposition completed through P8",
      "verdict": "pass",
      "evidence": "Phase commits and work/audit/R-0001/as-built.md"
    },
    {
      "criterion": "Full six-tier test ladder is green",
      "verdict": "pass",
      "evidence": "record/proofs/work/test-results/R-0001.jsonl"
    },
    {
      "criterion": "Every R-0001 deferral is matched to its governed backlog disposition",
      "verdict": "fail",
      "evidence": "One P7 deferral was unmatched at R-0001 close; it is now governed by BL-045 and remains a historical closure defect."
    },
    {
      "criterion": "Genesis remains provisionally bound pending predecessor R-Omega",
      "verdict": "pass",
      "evidence": "genesis-attestation.json is draft and frozen is false"
    },
    {
      "criterion": "Merged T1 and T3 coverage satisfies the unchanged policy",
      "verdict": "fail",
      "evidence": "BL-017 preserves the 70/60/70/70 thresholds and measured red state"
    },
    {
      "criterion": "Founding ratification and release completed",
      "verdict": "n/a",
      "evidence": "Explicitly outside R-0001; BL-001, BL-004, BL-005, BL-006, and BL-020 remain open"
    }
  ],
  "merged_as": "39ce7f8b501ee9bdbd4a8dc214f9c531cfbf0c04",
  "release_disposition": "none-preratification",
  "evidence": {
    "proof_epoch": "record/proofs/work/test-results/R-0001.jsonl",
    "terminal_sha256": "8d194dc04204719c2ea0144d1c171bf308212d41e013800077fc548f2e7673cd"
  },
  "notes": "Append-only correction to PC-0001. Historical gate results and proof-epoch binding are preserved; the sole correction records the unmatched P7 deferral now governed by BL-045. This record ratifies nothing, releases nothing, and claims no readiness or evidence standing.",
  "supersedes": "PC-0001"
}
